"id","favorite count","retweet count","text","created at"
897857245857361920,5,0,"open for a surprise https://t.co/DbhuHCAOtn","2017-08-16 16:27:03"
897609799126405120,0,0,"@itsJayceejo THANK U","2017-08-16 00:03:47"
897585556972072960,6,0,"hey https://t.co/CaDTZSpuKq","2017-08-15 22:27:27"
897549947951869952,0,0,"why does this fish have 4 human teeth on top https://t.co/8l4lDHNss5","2017-08-15 20:05:57"
897548894376210432,5,3,"if u let a guy change who you are, and ruin u to the point where u don't know who u are anymore, then stay away from relationships period","2017-08-15 20:01:46"
897547208278638599,0,0,"@t_flynn64 my right wrist!","2017-08-15 19:55:04"
897547009137291264,0,0,"@t_flynn64 that's so good to hear 💚","2017-08-15 19:54:17"
897538083620630530,0,0,"don't use big words and try to be all fancy. dumb it down","2017-08-15 19:18:49"
897538027840577536,0,0,"okay someone tell me what and when the eclipse is","2017-08-15 19:18:35"
897506814954278912,0,0,"annoyed","2017-08-15 17:14:34"
897506597920002049,0,0,"y'all need jesus https://t.co/asT6YbmLQ2","2017-08-15 17:13:42"
897391286990274560,0,1,"why do 25 year olds still hang out with high schoolers","2017-08-15 09:35:30"
897239399687217152,3,0,"who's going w me to hold my hand while i get tatted thursday","2017-08-14 23:31:57"
896923848184131585,0,1,"i am scared to grow up....","2017-08-14 02:38:04"
896920479071698944,0,0,"did they really just use that stupid pandora commercial music for this . https://t.co/NeqowdrpSb","2017-08-14 02:24:40"
896912119106490370,0,1,"should i make a video of me sharing my story? i said i'd do it a while ago but i never got time.","2017-08-14 01:51:27"
896577086147702784,0,0,"just gonna keep moving forward :)","2017-08-13 03:40:09"
896577044104007681,0,0,"it's almost embarrassing to see that i used to look like that. thank God i'm changed.","2017-08-13 03:39:59"
896576490690707457,3,0,"that last tweet wasn't a joke. i'm dead serious. the Lord has brought me so far &amp; i am forever grateful. He cleaned me from the inside-out!","2017-08-13 03:37:47"
896576026922196992,0,0,"don't do drugs https://t.co/hWGrHTG3pK","2017-08-13 03:35:57"
896319510298447876,0,0,"@notmarianapier his momma came in so clutch 😩💯","2017-08-12 10:36:38"
896214985579393024,5,6,"https://t.co/0ZLnfuK8Yt","2017-08-12 03:41:18"
896212140239015937,0,0,"never call out some1 if you don't know whats going on in their shoes. maybe they have a hard time figuring things out. negativity not needed","2017-08-12 03:29:59"
896211226518323201,0,0,"no respect for that behavior 🙅🏻","2017-08-12 03:26:21"
896210922066333696,0,0,"if you got ""jesus lover"" or ""god first"" in your bio... don't be cussing like a sailor on social media. doesn't make any sense","2017-08-12 03:25:09"
896210513805398016,0,0,"bought an otter box from walmart today&amp;i thought it'd cover the mic on my phone making it hard for ppl to hear me but it dont. best purchase","2017-08-12 03:23:31"
896161188475752448,9,0,"""why are you always at aaron's house"" https://t.co/Snvt2DCSVn","2017-08-12 00:07:31"
896075077879451651,1,0,"if only you didn't drop your phone in the water when i tried to make plans w you 😭😂 https://t.co/mztfcH2qy6","2017-08-11 18:25:21"
895962807421816832,0,1,"i have the best boyfriend ever.","2017-08-11 10:59:14"
895852452737687554,3,0,"i watching this thinking she was cheating &amp; didn't know how to tell him, but then... 😭 https://t.co/eNJ6ZJweWF","2017-08-11 03:40:43"
895835308230574080,6,1,"seeing everyone go separate ways today makes me so happy that 1) i'm not going to college this year. &amp; 2) glad that i have no friends 🤷‍♀️","2017-08-11 02:32:35"
895703842607812609,0,0,"@shalyn_smith35 Get the adoption papers ready","2017-08-10 17:50:12"
895680765828243456,2,0,"babe's last first day of school was today. i made sure he has the necessities. #gum #breakfast #money ❤️ https://t.co/WSz6yuXICi","2017-08-10 16:18:30"
895680553550327812,1,0,"slowly learning to not post my anger on social media 🙃","2017-08-10 16:17:39"
895609984440053762,1,0,"young mom 😂😭 https://t.co/Swz3qRbTzH","2017-08-10 11:37:14"
895609492347518976,5,1,"i will never understand why people leave the best for the worst","2017-08-10 11:35:17"
895475720817913856,19,17,"i don't care if it's -2 degrees, i will have my fan on.","2017-08-10 02:43:43"
895367415722377216,1,0,"@_jullliettt YESSS","2017-08-09 19:33:21"
895345909407649800,5,1,"can someone please give me a reason to dress up and get cute 🤔","2017-08-09 18:07:54"
895073450141904896,0,0,"😞","2017-08-09 00:05:14"
894938561820196864,0,0,"oh well you do you. i know what's mine","2017-08-08 15:09:14"
894937398207012864,3,0,"if your significant other is unable to work things out with you, then you might need to reevaluate.","2017-08-08 15:04:37"
894692239112380417,0,0,"#COLG revival","2017-08-07 22:50:27"
894532909461327873,3,1,"i can't trust anyone LOL","2017-08-07 12:17:19"
894387064451588096,2,1,"i love you reazon..... i'm so broken that you leave tomorrow. my angel ❤️ https://t.co/adxob5YUz4","2017-08-07 02:37:47"
893896219482869760,2,0,"babe is gonna be so excited ❤️❤️ https://t.co/yvX8ApLLKL","2017-08-05 18:07:21"
893883958550777856,0,0,"bout to go buy an apple watch for aaron. 😋😋","2017-08-05 17:18:37"
893313303543521280,0,0,"AARON THIS IS YOU OMG @AaronWilliams_7 https://t.co/Lers8GzJqB","2017-08-04 03:31:03"
893312665501696001,0,0,"@AaronWilliams_7 https://t.co/At2VcBb4UC","2017-08-04 03:28:31"
893306131359178752,11,0,"this was me when i was 15... and nowadays 15 year olds look like her https://t.co/ksbMHrpEEY","2017-08-04 03:02:33"
893301222299521028,5,0,"how are these 15 year olds prettier than me","2017-08-04 02:43:02"
893296118943158272,0,0,"19 in exactly a month? send da $$$ pls","2017-08-04 02:22:46"
892580371820417028,0,0,"I've been house sitting this huge house for a week and I cry every night because scary commercials come on.","2017-08-02 02:58:38"
892579634843439104,0,0,"This is terrible https://t.co/CE4mN8TfcT","2017-08-02 02:55:42"
892579569823350785,1,0,"If you get anxiety around someone you feel inferior to, you're more than likely dying for their approval. STOP... it will drain and ruin you","2017-08-02 02:55:27"
892572220245118977,1,0,"Happy early birthday daddy ❤️❤️ #aug3 https://t.co/D82oDtnMt8","2017-08-02 02:26:15"
892364831654805504,3,1,"I'm so tired of people using their bad moods as an excuse to be mean","2017-08-01 12:42:09"
892169121525366789,2,0,"It's not hard to like me 😅","2017-07-31 23:44:28"
892169078978359296,5,2,"I wanna be on good terms with everyone","2017-07-31 23:44:18"
892161307398549505,0,0,"@shalyn_smith35 I love youuuuu","2017-07-31 23:13:25"
892161280672485376,3,0,"Keep on preaching https://t.co/Jkv1wB1dXo","2017-07-31 23:13:19"
892049238183604225,1,1,"My body is rested but my mind isn't","2017-07-31 15:48:06"
891863926601920514,0,0,"Sleeping in ur bed while ur camping is pretty great :-) @AaronWilliams_7 https://t.co/Y95nNJqLMy","2017-07-31 03:31:44"
891755612954087427,4,0,"#NewProfilePic https://t.co/coNQc5Wgv4","2017-07-30 20:21:20"
891755395454291971,3,0,"Solid ❤️✊🏻 https://t.co/MBw9HIbneC","2017-07-30 20:20:28"
891755269381918720,0,0,"Nothing better than waking up to kisses on the cheek","2017-07-30 20:19:58"
891149688682024960,3,0,"#NewProfilePic https://t.co/Dka4mrTqFW","2017-07-29 04:13:37"
891147994275434497,2,0,"Aaron is in love with Sadie Robertson. And now I wanna be her","2017-07-29 04:06:53"
891108008259964928,0,0,"Say to Siri : what is zero divided by zero?","2017-07-29 01:27:59"
891031106291740672,1,0,"THERE WAS A SPIDER ON ME. ITS WEB WAS EITHER ATTACHED TO ME OR IT WAS FLYING. #SENDPOLICE","2017-07-28 20:22:24"
891030574311321601,1,0,"@laurenald_ This is so stunning","2017-07-28 20:20:18"
890536099008872448,0,0,"Ohio State Fair Accident 2017 https://t.co/YzGcX4cpTV","2017-07-27 11:35:26"
890341486281338880,0,0,"does anyone else eat out of cups and mugs","2017-07-26 22:42:06"
890338799150039040,3,0,"COMMUNICATION WILL HELP US FEMALES TO NOT WORRY https://t.co/8L4Vv9X51m","2017-07-26 22:31:26"
890028671645491203,3,0,"Daily post with my lover https://t.co/zcebqnN8nc","2017-07-26 01:59:05"
889598708031131648,1,0,"Follow my account on insta if you want positivity and good vibes :) https://t.co/T3k1sH6m1w","2017-07-24 21:30:34"
889429740649578500,6,1,"Now that I live in mt sterling w my nanny, I feel so so so happy and relaxed. God is good","2017-07-24 10:19:09"
889324296874668034,0,0,"I've learned this past week to not post every single feeling you feel on social media. 1) It makes you look foolish 2) No one actually cares","2017-07-24 03:20:09"
889322632189009921,2,0,"Hebrews 6:15","2017-07-24 03:13:32"
889312550881562625,2,0,"😩❤️😻 I seriously cant ever get enough of you https://t.co/u86hsMbzIS","2017-07-24 02:33:29"
889190219521695744,0,0,"My life is great rn","2017-07-23 18:27:23"
889190137858576384,0,0,"If you're only all about a few people and cut everyone else off when they try to reach out to you, then I lose respect for you.","2017-07-23 18:27:03"
889091984257945600,6,0,"🤷‍♀️ https://t.co/xCvKbTw8yO","2017-07-23 11:57:02"
888737858932154369,1,0,"If this isn't @sebashford 😂😩 https://t.co/LsZKsTyCKR","2017-07-22 12:29:52"
888595067174301696,0,0,"Just went thru my tweets and I can see how negative I am 😩😩","2017-07-22 03:02:27"
888467232682110976,0,1,"Most people will use rude gestures showing they don't like you, but what's it matter if they don't know you","2017-07-21 18:34:29"
888467058521976832,1,0,"Me: we are identical.
Aaron: no I actually have eyebrows...","2017-07-21 18:33:48"
888443004587053061,1,0,"@sebashford Luv","2017-07-21 16:58:13"
887731211061284864,0,2,"Nothing is more irritating then someone not hearing you on the phone","2017-07-19 17:49:48"
887673486839349248,1,0,"@laurenald_ This makes me cry 😂😩","2017-07-19 14:00:26"
886726797450240001,0,1,"I hate humbling myself.","2017-07-16 23:18:37"
886726752189501440,1,3,"I need positive people","2017-07-16 23:18:26"
886663391934328833,0,0,"I am full of hate and anger and it's seriously gonna get me into trouble.","2017-07-16 19:06:40"
886663204419534848,2,0,"YEAAAAA GIRL PREACH https://t.co/D8sVpcoJ2e","2017-07-16 19:05:55"
886621440124080129,0,0,"I promise you're the last thing I need","2017-07-16 16:19:58"
886474103439466496,0,0,"Ugh","2017-07-16 06:34:30"
886414600492773376,0,0,"@Elisachaise I'm so tempted to put it on here hahahah. I'll just text you","2017-07-16 02:38:04"
886408926669004800,0,0,"Sketchy","2017-07-16 02:15:31"
886393051194826752,3,0,"Things happen for a reason. I know that for sure... 😞","2017-07-16 01:12:26"
886302530673758208,14,0,"#NewProfilePic https://t.co/qLZwFcQtLH","2017-07-15 19:12:44"
886296181260918785,3,6,"Love yourself first.","2017-07-15 18:47:30"
